{
  "schema_version": "1.0.0",
  "probe_version": "0.1.0",
  "report_id": "sha256:7f8a961442079a43a4837221a2f3d948bfa606957d0f2b409b8c0d7580a7cd6b",
  "created_at": "2026-07-31T12:00:00.000Z",
  "provenance": { "kind": "fixture", "fixture_id": "success" },
  "consent": { "fingerprint_acknowledged": true, "publication": true },
  "platform": {
    "os": { "family": "macos", "version": "15.5", "build": "24F74" },
    "architecture": "arm64",
    "cpu": { "vendor": "Apple", "model": "Apple M3 Pro", "family": "M3", "feature_flags": ["neon"] },
    "memory_bucket": "16-31-gib",
    "gpus": [{ "index": 0, "vendor": "Apple", "model": "M3 Pro Integrated", "device_id": null, "driver_version": null }]
  },
  "runtime": { "node_version": "22.17.0" },
  "qvac": {
    "discovery": { "status": "passed", "reason": "completed", "duration_ms": 12 },
    "sdk_version": "0.16.0",
    "packages": [{ "name": "@qvac/sdk", "version": "0.16.0" }]
  },
  "official_checks": {
    "doctor": { "status": "passed", "reason": "completed", "duration_ms": 320 },
    "bundle_verification": { "status": "skipped", "reason": "not-applicable", "duration_ms": null }
  },
  "profile": {
    "id": "atlas-small-llm-lifecycle-test",
    "version": "1.0.0",
    "artifact_sha256": "aaaaaaaaaaaaaaaaaaaaaaaaaaaaaaaaaaaaaaaaaaaaaaaaaaaaaaaaaaaaaaaa",
    "requested_backend": "gpu"
  },
  "execution": {
    "phases": [
      { "name": "qvac-import", "status": "passed", "duration_ms": 35 },
      { "name": "worker-start", "status": "passed", "duration_ms": 210 },
      { "name": "model-load", "status": "passed", "duration_ms": 840 },
      { "name": "inference", "status": "passed", "duration_ms": 420 },
      { "name": "clean-shutdown", "status": "passed", "duration_ms": 42 }
    ],
    "backend_observation": { "status": "observed", "backend": "gpu", "method": "runner-event" },
    "termination": { "kind": "clean-exit", "exit_code": 0, "signal": null, "last_completed_phase": "clean-shutdown" }
  },
  "result": {
    "workload_status": "passed",
    "completion_observed": true,
    "failure": { "category": "none", "phase": null, "code": null, "sanitized_excerpt": null }
  },
  "privacy": {
    "collection_policy": "allowlist-v1",
    "sanitizer_version": "0.1.0",
    "redaction_counts": { "credentials": 0, "identifiers": 0, "network": 0, "paths": 0 }
  }
}
